{"captured":{"character":"fixture-player","day":12,"hour":8,"minute":30},"modVersion":"fixture-v1","modules":{"accounting":{"data":{"adjustment":"none","coverage":"statement-backed-only","source":"game.financialSummaries"},"status":"ready","version":1},"businesses":{"data":[{"name":"Cafe \"München\"\u000a& Co","number":1,"street":"ba:street_test","temporarilyClosed":false,"typeId":"reallife:businesstype_test"}],"status":"ready","version":1},"credit":{"data":null,"status":"failed","version":1},"employment":{"data":null,"status":"unavailable","version":1},"features":{"data":null,"status":"disabled","version":1}},"provider":"rlo","schemaVersion":1}
