{"captured":{"character":"fixture-player","day":12,"hour":8,"minute":30},"modVersion":"fixture-v1","modules":{"accounting":{"data":{"adjustment":"none","coverage":"statement-backed-only","source":"game.financialSummaries"},"status":"ready","version":1},"businesses":{"data":[{"name":"Cafe \"München\"\u000a& Co","number":1,"street":"ba:street_test","temporarilyClosed":false,"typeId":"reallife:businesstype_test"}],"status":"ready","version":1},"credit":{"data":[{"annualRateBasisPoints":800,"balanceCents":1200000,"frozen":false,"id":"1","includedInGameLoans":false,"kind":"car","paymentTomorrowCents":11600},{"annualRateBasisPoints":900,"balanceCents":5000000,"frozen":true,"id":"2","includedInGameLoans":false,"kind":"home","paymentTomorrowCents":0}],"status":"ready","version":1},"employment":{"data":[{"baseHourlyCents":2000,"cityHourlyCents":200,"employeeId":"employee-1","ordinaryHourlyCents":2350,"raiseHourlyCents":150}],"status":"ready","version":1},"features":{"data":[{"enabled":true,"id":"staff","running":true},{"enabled":false,"id":"managers","running":false}],"status":"ready","version":1}},"provider":"rlo","schemaVersion":1}
